{
  "schemaVersion": "1.0.0",
  "id": "gone-content",
  "name": "Gone content registry",
  "locations": [
    {
      "id": "piata-unirii",
      "name": "Piața Unirii",
      "description": "Overcast open-square reconnaissance",
      "manifest": "locations/piata-unirii/manifest.json"
    },
    {
      "id": "vatra-central-station",
      "name": "Vatra Central Station",
      "description": "Contemporary railway infiltration after rain",
      "manifest": "locations/vatra-central-station/manifest.json"
    },
    {
      "id": "cluj-napoca-station",
      "name": "Gara Cluj-Napoca",
      "description": "Hartă pietonală a gării, peroanelor și Pieței Gării",
      "manifest": "locations/cluj-napoca-station/manifest.json"
    }
  ]
}
